Name,Apple Store,Android Store,Summary,Logo
"Sound Therapy, Relaxation Exercises, and Hearing Test: Beltone Tinnitus Calmer",https://apps.apple.com/app/id950219326,https://play.google.com/store/apps/details?id=com.beltone.tinnitus&hl=en_US&gl=US,"Offers sound therapy, relaxation exercises, and a hearing test for managing tinnitus symptoms.",https://is1-ssl.mzstatic.com/image/thumb/Purple123/v4/81/a2/df/81a2dfed-ee7d-afe7-49c7-f6344950f769/AppIcon-0-0-1x_U007emarketing-0-0-0-5-0-0-sRGB-0-0-0-GLES2_U002c0-512MB-85-220-0-0.jpeg/230x0w.webp
Tinnitus Masking: Tinnitus Therapy Lite,https://itunes.apple.com/us/app/sound-oasis-tinnitus-therapy/id794541814?mt=8,https://play.google.com/store/apps/details?id=com.soundoasis.tinLiteV2,Designed to mask the symptoms of tinnitus by providing various sounds and noise types.,https://is1-ssl.mzstatic.com/image/thumb/Purple116/v4/0b/78/3f/0b783f3e-43cf-43a7-f790-324e64f30566/AppIcon-0-1x_U007emarketing-0-10-0-85-220-0.png/230x0w.webp
Learn and Practice Cognitive Behavioral Therapy: CBT Companion,https://apps.apple.com/us/app/cbt-companion/id1445499245,https://play.google.com/store/apps/details?id=co.swasth.cbtcompanion,Focuses on cognitive-behavioral therapy (CBT) techniques to help individuals manage mental health.,https://is1-ssl.mzstatic.com/image/thumb/Purple122/v4/7b/11/f4/7b11f48a-5264-aa4e-e8c9-a6ce6c982d80/AppIcon-0-0-1x_U007emarketing-0-0-0-6-0-0-sRGB-0-0-0-GLES2_U002c0-512MB-85-220-0-0.png/230x0w.webp
Hearing Protection and dB Meter: iOS: NIOSH Sound Level Meter,https://itunes.apple.com/us/app/niosh-slm/id1096545820?mt=8,none,Measures sound levels in the environment and provides alerts for potential hearing damage.,https://is1-ssl.mzstatic.com/image/thumb/Purple113/v4/1e/17/9b/1e179b2d-a642-af2b-f2ec-e36db1fe8563/AppIcon-0-0-1x_U007emarketing-0-0-0-5-0-0-sRGB-0-0-0-GLES2_U002c0-512MB-85-220-0-0.png/230x0w.webp
HearAngel,none,https://play.google.com/store/apps/details?id=com.hearangel,Measures sound levels in the environment and provides alerts for potential hearing damage.,https://play-lh.googleusercontent.com/ulsTlYuzrkaynPlpPMf_sfKmGq2Irjd5En9b2xZyhrJb9x6IcD5_tCbPpgD5BCAEwIw=w240-h480-rw
Hearing Enhancement and Hearing Test: Petralex Hearing Aid (Lite),https://itunes.apple.com/us/app/apple-store/id816133779?pt=10593899&ct=sait&mt=8,https://play.google.com/store/apps/details?id=com.it4you.petralex,Serves as a hearing aid by enhancing sound for individuals with hearing impairments.,https://is1-ssl.mzstatic.com/image/thumb/Purple122/v4/ae/e9/d9/aee9d9cd-002b-850b-417a-d0d7fc3de3a3/AppIcon-0-1x_U007emarketing-0-4-0-0-85-220-0.png/230x0w.webp
Track Your Tinnitus,none,https://play.google.com/store/apps/details?id=com.jochenherrmann.trackyourtinnitus,Allows for tracking tinnitus triggers,https://play-lh.googleusercontent.com/t7QMi78cpiCZ3ESThgEnLOya4URltzYM4W7e8nWUHfTzGbnwt_-PUpAFDQtEMAq7YWNh=w480-h960